<!-- Root fileElement -->
<!ELEMENT root (projectActionList*) >
   <!ATTLIST root version CDATA #REQUIRED >
 
<!-- List of actions to be applied to a project -->
<!ELEMENT projectActionList (applyWhen|projectActionList|projectActionListRef|variable|block|excludeSourceFile|excludeSourceFolder|createFolder|copy|projectOption|customAction)*>
   <!ATTLIST projectActionList id    ID     #IMPLIED>
   <!ATTLIST projectActionList root  CDATA  #IMPLIED>

<!-- Condition controlling when list action is applied -->
<!ELEMENT applyWhen (and|or|not|variableRef|deviceNameIs|deviceFamilyIs|deviceSubfamilyIs|deviceNameMatches|deviceFamilyMatches|deviceSubfamilyMatches)>

<!ELEMENT and ((and|or|not|variableRef|deviceNameIs|deviceFamilyIs|deviceSubfamilyIs|deviceNameMatches|deviceFamilyMatches|deviceSubfamilyMatches)*) >
<!ELEMENT or  ((and|or|not|variableRef|deviceNameIs|deviceFamilyIs|deviceSubfamilyIs|deviceNameMatches|deviceFamilyMatches|deviceSubfamilyMatches)*) >
<!ELEMENT not  (and|or|not|variableRef|deviceNameIs|deviceFamilyIs|deviceSubfamilyIs|deviceNameMatches|deviceFamilyMatches|deviceSubfamilyMatches) >

<!ELEMENT variableRef EMPTY >
   <!ATTLIST variableRef idRef 			CDATA 			#REQUIRED>
   <!ATTLIST variableRef condition 		(isTrue|lessThan|lessThanOrEqual|equal|greaterThan|greaterThanOrEqual) "isTrue">
   <!ATTLIST variableRef defaultValue 	(true|false) 	#IMPLIED>
   <!ATTLIST variableRef value   		CDATA 			#IMPLIED>

<!ELEMENT deviceNameIs (#PCDATA) >
<!ELEMENT deviceFamilyIs (#PCDATA) >
<!ELEMENT deviceSubfamilyIs (#PCDATA) >
<!ELEMENT deviceNameMatches (#PCDATA) >
<!ELEMENT deviceFamilyMatches (#PCDATA) >
<!ELEMENT deviceSubfamilyMatches (#PCDATA) >

<!ELEMENT projectActionListRef EMPTY>
   <!ATTLIST projectActionListRef ref IDREF #REQUIRED>
 
<!-- Variable controlling a block -->
<!ELEMENT variable ((requirement|preclusion)*) >
   <!ATTLIST variable id           CDATA #REQUIRED>
   <!ATTLIST variable name         CDATA #IMPLIED>
   <!ATTLIST variable description  CDATA #IMPLIED>
   <!ATTLIST variable type         (boolean) 	"boolean" >
   <!ATTLIST variable defaultValue (true|false) "false">
   <!ATTLIST variable values       CDATA #IMPLIED>
   
<!ELEMENT requirement EMPTY >
   <!ATTLIST requirement idRef CDATA #REQUIRED>

<!ELEMENT preclusion EMPTY >
   <!ATTLIST preclusion idRef CDATA #REQUIRED>

<!-- Condition controlling actions -->
<!ELEMENT block (applyWhen,(excludeSourceFile|excludeSourceFolder|createFolder|copy|deleteResource|projectOption|customAction)*)>
   <!--ATTLIST block variable    IDREF  #REQUIRED -->
   <!--ATTLIST block negated     (true|false) "false" -->
   
<!-- Exclude/include source file in Eclipse project -->
<!ELEMENT excludeSourceFile EMPTY >
   <!ATTLIST excludeSourceFile target  CDATA         #REQUIRED>
   <!ATTLIST excludeSourceFile excluded (true|false) "true" >

<!-- Exclude/include source folder in Eclipse project -->
<!ELEMENT excludeSourceFolder EMPTY >
   <!ATTLIST excludeSourceFolder target  CDATA         #REQUIRED>
   <!ATTLIST excludeSourceFolder excluded (true|false) "true" >

<!-- Remove file from Eclipse project -->
<!ELEMENT deleteResource EMPTY >
   <!ATTLIST deleteResource target  CDATA         #REQUIRED>

 <!ELEMENT createFolder EMPTY >
   <!ATTLIST createFolder target  CDATA #REQUIRED>
   <!ATTLIST createFolder type    CDATA #REQUIRED>

<!-- File to be copied to a project -->
<!ELEMENT copy EMPTY >
   <!ATTLIST copy source  				CDATA #REQUIRED>
   <!ATTLIST copy target  				CDATA #REQUIRED>
   <!ATTLIST copy type    				CDATA #IMPLIED>
   <!ATTLIST copy macroReplacement  (true|false) "true">
   <!ATTLIST copy replace           (true|false) "false">
   
<!-- Eclipse project options (for gcc, gdb etc) -->
<!ELEMENT projectOption (value*)>
   <!ATTLIST projectOption id        CDATA        #REQUIRED>
   <!ATTLIST projectOption replace   (true|false) "false">

<!-- Custom build action -->
<!ELEMENT customAction (value)* >
   <!ATTLIST customAction class       CDATA #REQUIRED>
   
<!-- Attribute value for projectOption --> 
<!ELEMENT value (#PCDATA)>  
   