<?xml version="1.0" encoding="UTF-8" standalone="no" ?>
<!DOCTYPE root SYSTEM "../package.dtd">

<root version="1.0" >

   <!-- Blinky example for Freedom board -->
   <projectActionList id="FRDM-Blinky-MK" >
      <applyWhen>
         <and>
            <or>
               <deviceFamilyMatches>CortexM4</deviceFamilyMatches>
               <deviceFamilyMatches>CortexM4F</deviceFamilyMatches>
            </or>
            <or>
               <deviceNameMatches>^FRDM-.*</deviceNameMatches>
               <deviceNameMatches>^TWR-.*</deviceNameMatches>
            </or>
         </and>
      </applyWhen>
      <variable id="projectOptionValue.FRDM-Blinky" name="Blinky example" description="Add Blinky Example code for Freedom board" />
      <block>
         <applyWhen >
            <variableRef idRef="projectOptionValue.FRDM-Blinky" />
         </applyWhen>
         <copy source="Project_Headers/leds.h"        target="Project_Headers/leds.h" />
         <copy source="Project_Headers/Board_LEDs.h"  target="Project_Headers/Board_LEDs.h" />
         <copy source="Sources/leds.c"                target="Sources/leds.c" />
         <copy source="Sources/main.c"                target="Sources/main.c" replace="true" />
      </block>
   </projectActionList>

   <!-- Blinky example for Freedom board -->
   <projectActionList id="FRDM-Blinky-MKL" >
      <applyWhen>
         <and>
            <deviceNameMatches>^FRDM-.*</deviceNameMatches>
            <deviceFamilyMatches>CortexM0</deviceFamilyMatches>
            <deviceSubfamilyMatches>^MKL\d+.*</deviceSubfamilyMatches>
         </and>
      </applyWhen>
      <variable id="projectOptionValue.FRDM-Blinky" name="Blinky example" description="Add Blinky Example code for Freedom board" />
      <block>
         <applyWhen >
            <variableRef idRef="projectOptionValue.FRDM-Blinky" />
         </applyWhen>
         <copy source="Project_Headers/leds.h"        target="Project_Headers/leds.h" />
         <copy source="Project_Headers/Board_LEDs.h"  target="Project_Headers/Board_LEDs.h" />
         <copy source="Sources/leds.c"                target="Sources/leds.c" />
         <copy source="Sources/main.c"                target="Sources/main.c" replace="true" />
      </block>
   </projectActionList>

   <!-- Blinky example for Freedom board -->
   <projectActionList id="FRDM-Blinky-MKE" >
      <applyWhen>
         <and>
            <deviceNameMatches>^FRDM-.*</deviceNameMatches>
            <deviceFamilyMatches>CortexM0</deviceFamilyMatches>
            <deviceSubfamilyMatches>^MKE\d+.*</deviceSubfamilyMatches>
         </and>
      </applyWhen>
      <variable id="projectOptionValue.FRDM-Blinky" name="Blinky example" description="Add Blinky Example code for Freedom board" />
      <block>
         <applyWhen >
            <variableRef idRef="projectOptionValue.FRDM-Blinky" />
         </applyWhen>
         <copy source="Project_Headers/leds.h"        target="Project_Headers/leds.h" />
         <copy source="Project_Headers/Board_LEDs.h"  target="Project_Headers/Board_LEDs.h" />
         <copy source="Sources/leds-mke.c"            target="Sources/leds.c" />
         <copy source="Sources/main.c"                target="Sources/main.c" replace="true" />
      </block>
   </projectActionList>

   <!-- Blinky example for Freedom board -->
   <projectActionList id="FRDM-Blinky-MKM" >
      <applyWhen>
         <and>
            <deviceNameMatches>^FRDM-.*</deviceNameMatches>
            <deviceFamilyMatches>CortexM0</deviceFamilyMatches>
            <deviceSubfamilyMatches>^MKM\d+.*</deviceSubfamilyMatches>
         </and>
      </applyWhen>
      <variable id="projectOptionValue.FRDM-Blinky" name="Blinky example" description="Add Blinky Example code for Freedom board" />
      <block>
         <applyWhen >
            <variableRef idRef="projectOptionValue.FRDM-Blinky" />
         </applyWhen>
         <copy source="Project_Headers/leds.h"        target="Project_Headers/leds.h" />
         <copy source="Project_Headers/Board_LEDs.h"  target="Project_Headers/Board_LEDs.h" />
         <copy source="Sources/leds-mkm.c"            target="Sources/leds.c" />
         <copy source="Sources/main.c"                target="Sources/main.c" replace="true" />
      </block>
   </projectActionList>

</root>
