<?xml version="1.0" encoding="UTF-8" standalone="no" ?>
<!DOCTYPE root SYSTEM "../package.dtd">

<root version="1.0" >

   <!-- Cortex-M0,M3,M4 -->    
   <projectActionList id="Cortex-Project-actions" >
      <applyWhen>
         <and>
            <deviceFamilyMatches>CortexM0</deviceFamilyMatches>
         </and>
      </applyWhen>
      <!--  Not sufficient RAM for standard-C library initialisation (newlib mostly) -->
      <variable id="linkerRamSize"   />
      <variable id="linkerFlashSize" />
      <block>
         <applyWhen>
            <variableRef idRef="linkerRamSize" condition="lessThanOrEqual" value="2048" />
         </applyWhen>
         <projectOption id="gnu.cpp.link.option.nostart">
            <value>true</value>
         </projectOption>
         <projectOption id="net.sourceforge.usbdm.gnu.c.compiler.option.preprocessor.def.symbols">
            <value>__NO_STARTFILES__</value>
         </projectOption>
         <projectOption id="net.sourceforge.usbdm.gnu.cpp.compiler.option.preprocessor.def.symbols">
            <value>__NO_STARTFILES__</value>
         </projectOption>
      </block>
   </projectActionList>
</root>
