<?xml version="1.0" encoding="UTF-8" standalone="no" ?>
<!DOCTYPE root SYSTEM "../package.dtd">

<root version="1.0">
   <!-- Additions for STM32xx SPL -->
   <projectActionList id="STM32-spl-files" >
      <applyWhen>
         <deviceSubfamilyIs>STM32</deviceSubfamilyIs>
      </applyWhen>
      <variable id="STM32-spl" name="Standard Peripheral Library"
         description="Adds code for the STM32 Standard peripheral Library - check assumptions made" />
      <condition variable="STM32-spl">
         <createFolder target="spl" type="include" />
         <copy source="../spl/Release_Notes.html" target="SPL.html" type="link" />
         <copy source="../spl/inc" target="spl/inc" />
         <copy source="../spl/src" target="spl/src" />
         <projectOption id="net.sourceforge.usbdm.gnu.c.compiler.option.include.paths">
            <value>&quot;${ProjDirPath}/spl/inc&quot;</value>
            <value>&quot;${ProjDirPath}/spl/src&quot;</value>
         </projectOption>
         <projectOption id="net.sourceforge.usbdm.gnu.cpp.compiler.option.include.paths">
            <value>&quot;${ProjDirPath}/spl/inc&quot;</value>
            <value>&quot;${ProjDirPath}/spl/src&quot;</value>
         </projectOption>
         <projectOption id="net.sourceforge.usbdm.gnu.cpp.compiler.option.preprocessor.def.symbols">
            <value>USE_STDPERIPH_DRIVER</value>
         </projectOption>
         <projectOption id="net.sourceforge.usbdm.gnu.c.compiler.option.preprocessor.def.symbols">
            <value>USE_STDPERIPH_DRIVER</value>
         </projectOption>
      </condition>
   </projectActionList>
</root>