<?xml version="1.0" encoding="UTF-8" standalone="no" ?>
<!DOCTYPE root SYSTEM "../package.dtd">

<root version="1.0">
   <!-- GNU Build options Cortex M0 (e.g. MKL, MKE) devices -->
   <projectActionList id="gnuSettings.cortex.m0">
      <applyWhen>
         <deviceFamilyIs>CortexM0</deviceFamilyIs>
      </applyWhen>
      <projectOption id="net.sourceforge.usbdm.cdt.arm.toolchain.mcpu">
         <value>net.sourceforge.usbdm.cdt.arm.toolchain.mcpu.cortexM0</value>
      </projectOption>
      <projectOption id="net.sourceforge.usbdm.cdt.arm.toolchain.mthumb">
         <value>true</value>
      </projectOption>
      <projectOption id="net.sourceforge.usbdm.cdt.arm.toolchain.buildtools">
         <value>$(buildToolId)</value>
      </projectOption>
      <projectOption id="net.sourceforge.usbdm.cdt.toolchain.c.linker.linkerFile">
         <value>$(linkerFile)</value>
      </projectOption>
      <projectOption id="net.sourceforge.usbdm.cdt.toolchain.cpp.linker.linkerFile">
         <value>$(linkerFile)</value>
      </projectOption>
      <projectOption id="gnu.c.link.option.paths">
         <value>&quot;${ProjDirPath}/Project_Settings/Linker_Files&quot;</value>
      </projectOption>
      <projectOption id="gnu.cpp.link.option.paths">
         <value>&quot;${ProjDirPath}/Project_Settings/Linker_Files&quot;</value>
      </projectOption>
   </projectActionList>
</root>