<?xml version="1.0" encoding="UTF-8" standalone="no" ?>
<!DOCTYPE root SYSTEM "../package.dtd">

<root version="1.0" >
   <!-- Extra Optional files for Coldfire V1+ -->
   <projectActionList id="Options-file-list-CFV1Plus" >
      <applyWhen>
         <deviceFamilyIs>CFV1Plus</deviceFamilyIs>
      </applyWhen>
      <variable id="projectOptionValue.Clock-setup" name="Clock setup code" description="Adds code for basic clock initialization - check assumptions made" />
      <variable id="projectOptionValue.UART-setup" name="UART setup code" description="Adds C stdio (UART) support for newlib">
         <requirement idRef="projectOptionValue.Clock-setup"/>
      </variable>
      <block>
         <applyWhen>
            <variableRef idRef="projectOptionValue.Clock-setup" />
         </applyWhen>
         <copy source="Startup_Code/clock-cfv1plus.c"                   target="Startup_Code/clock.c" />
         <copy source="Project_Headers/clock_configure-cfv1plus.h"      target="Project_Headers/clock_configure.h" />
      </block>
      <block>
         <applyWhen>
            <variableRef idRef="projectOptionValue.UART-setup" />
         </applyWhen>
         <copy source="Startup_Code/uart.c"                         target="Startup_Code/uart.c" />
         <copy source="Project_Headers/uart.h"                      target="Project_Headers/uart.h" />
         <copy source="Sources/main-uart.c"                         target="Sources/main.c" replace="true"/>
      </block>
   </projectActionList>

</root>