<?xml version="1.0" encoding="UTF-8" standalone="no" ?>
<!DOCTYPE root SYSTEM "../package.dtd">

<root version="1.0">
   <!-- Extra Optional files for MKE04, MKE06 -->
   <projectActionList id="Options-file-list-MKE0xZ4">
      <applyWhen>
         <or>
            <deviceSubfamilyIs>MKE04Z4</deviceSubfamilyIs>
            <deviceSubfamilyIs>MKE06Z4</deviceSubfamilyIs>
	      </or>
      </applyWhen>
      
      <!-- MKE04 & MKE06 have a BME that can manipulate SRAM_U and a bit-band for SRAM_U as well -->
      <copy source="Project_Settings/Linker_Files/ARMLtd_GCC-rom-mk-sramu.ld"  target="Project_Settings/Linker_Files/Linker-rom.ld" replace="true" />
      <copy source="Project_Settings/Linker_Files/MemoryMap-sramu.ld"          target="Project_Settings/Linker_Files/MemoryMap-$(targetDeviceName).ld"  replace="true" />
      <copy source="Project_Headers/bitband-mke.h"                             target="Project_Headers/bitband.h" />

      <variable id="projectOptionValue.Clock-setup" name="Clock setup code" description="Adds code for basic clock initialization - check assumptions made" />
      <variable id="projectOptionValue.UART-setup" name="UART setup code" description="Adds C stdio (UART) support for newlib" >
         <requirement idRef="projectOptionValue.Clock-setup"/>
      </variable>
      
      <block>
         <applyWhen>
            <variableRef idRef="projectOptionValue.Clock-setup" />
         </applyWhen>
         <copy source="Startup_Code/clock-MKE0x.c" target="Startup_Code/clock.c" />
         <copy source="Project_Headers/clock_configure-MKE0x.h" target="Project_Headers/clock_configure.h" />
      </block>
      <block>
         <applyWhen>
            <variableRef idRef="projectOptionValue.UART-setup" />
         </applyWhen>
         <copy source="Startup_Code/uart-mke.c" target="Startup_Code/uart.c" />
         <copy source="Project_Headers/uart.h" target="Project_Headers/uart.h" />
      </block>

   </projectActionList>
</root>